{
  "activation": {
    "authorization_requirement": "explicit repository-owner authorization after BH-01 completion",
    "authorized": false,
    "eligible": true,
    "may_start": false
  },
  "baseline_ref": {
    "path": "docs/research/assets/bh-01-release/blazex-bh-01-feasibility-baseline-v0.1.0.json",
    "sha256": "2e8f96b2afe2e139543c898249161b8e5794a4876eccd8bac679a4347e1134ff"
  },
  "conditions": [
    {
      "blocks": [
        "release readiness",
        "application payload pass"
      ],
      "expiry": "Expires when superseded by accepted measured reachability evidence.",
      "id": "BX-BH01-CONDITION-AVM-REACHABILITY",
      "owner": "build-owner",
      "required_action": "Run a sound module-reachability experiment with before/after manifests and repeat affected Phases 3\u201310 proofs.",
      "trigger": "Before release qualification or material bundle composition change"
    },
    {
      "blocks": [
        "production deployment",
        "transfer-size claim"
      ],
      "expiry": "Expires when an accepted production-serving profile supersedes the local estimate.",
      "id": "BX-BH01-CONDITION-BROTLI-SERVING",
      "owner": "browser-profile-owner",
      "required_action": "Verify actual precompressed serving, negotiation, MIME, integrity, cache, isolation, proxy, and CDN behavior.",
      "trigger": "Before production profile deployment or transfer-size claim"
    },
    {
      "blocks": [
        "Firefox support",
        "local interaction budget pass"
      ],
      "expiry": "Expires only on accepted same-boundary stable-product evidence.",
      "id": "BX-BH01-CONDITION-FIREFOX-TIMER",
      "owner": "quality-owner",
      "required_action": "Attribute harness/runtime phases, optimize without changing semantics, and repeat the same timer distribution in a stable Firefox product.",
      "trigger": "Before stable Firefox support or interaction-budget promotion"
    },
    {
      "blocks": [
        "optional adapter compatibility",
        "package upgrade"
      ],
      "expiry": "Reevaluated at every private dependency revision.",
      "id": "BX-BH01-CONDITION-PRIVATE-API-PINS",
      "owner": "liveview-adapter-owner",
      "required_action": "Repeat private-surface inventory and compatibility probes while retaining standalone DOM fallback and neutral package isolation.",
      "trigger": "Any Phoenix, LiveView, LocalLiveView, or optional adapter change"
    },
    {
      "blocks": [
        "baseline supersession",
        "runtime compatibility claim"
      ],
      "expiry": "Reevaluated at every named runtime or toolchain change.",
      "id": "BX-BH01-CONDITION-RUNTIME-REPEAT",
      "owner": "runtime-owner",
      "required_action": "Repeat affected runtime, browser, behavior, resilience, measurement, and clean-rebuild proofs from immutable inputs.",
      "trigger": "Any runtime, OTP, Popcorn, toolchain, bridge, or canonical build-root change"
    },
    {
      "blocks": [
        "production security",
        "production deployment"
      ],
      "expiry": "Expires only through an accepted production security gate.",
      "id": "BX-BH01-CONDITION-PRODUCTION-SECURITY",
      "owner": "security-owner",
      "required_action": "Design and validate production identity, TLS/proxy, persistence, distributed limits, CSP, audit, monitoring, and penetration-test controls.",
      "trigger": "Before production authentication, deployment, or security claim"
    },
    {
      "blocks": [
        "browser support",
        "mobile viability",
        "cross-platform support",
        "accessibility conformance",
        "release readiness"
      ],
      "expiry": "Remains open until BH-22 qualification accepts or rejects each deferred row.",
      "id": "BX-BH01-CONDITION-BH22-QUALIFICATION",
      "owner": "quality-owner",
      "required_action": "Execute non-substitutable platform, stable-browser, physical-device, mobile, and manual assistive-technology qualification.",
      "trigger": "BH-22 start or availability of representative external environments"
    },
    {
      "blocks": [
        "public API stabilization",
        "host-neutral contract acceptance"
      ],
      "expiry": "Expires only when BH-02 accepts independently reviewed neutral contracts.",
      "id": "BX-BH01-CONDITION-FIXTURE-DISPOSABILITY",
      "owner": "architecture-owner",
      "required_action": "Derive neutral contracts from observable facts and prohibit BH-01 messages, DOM operations, Phoenix routes, and profile fixtures from becoming public APIs by default.",
      "trigger": "During BH-02 semantic, renderer, capability, effect, or resource contract design"
    },
    {
      "blocks": [
        "package publication",
        "release readiness"
      ],
      "expiry": "Expires only through an accepted release gate.",
      "id": "BX-BH01-CONDITION-RELEASE-CONTROLS",
      "owner": "build-owner",
      "required_action": "Complete SBOM, license/notice, signing, source-map, reachability, production serving, rollback, provenance, and release invalidation gates.",
      "trigger": "Before package publication or release-readiness claim"
    }
  ],
  "decision_ref": {
    "path": "docs/research/assets/bh-01-release/blazex-bh-01-feasibility-decision-v0.1.0.json",
    "sha256": "e2363cef39b55f000b3d16ceb1f433f0144df71019bf9803c0a8921a0230660f"
  },
  "deferred_qualification": [
    {
      "environment": "representative physical Android phone and tablet with governed Chrome build",
      "id": "BX-BH01-DEFER-ANDROID-PHYSICAL-0.1",
      "owner": "browser-host and quality owners",
      "reactivation": "BH-22 or earlier when representative Android infrastructure becomes available",
      "status": "deferred"
    },
    {
      "environment": "representative iPhone and iPad with governed iOS/iPadOS Safari builds",
      "id": "BX-BH01-DEFER-APPLE-MOBILE-0.1",
      "owner": "browser-host and quality owners",
      "reactivation": "BH-22 or earlier when representative Apple mobile infrastructure becomes available",
      "status": "deferred"
    },
    {
      "environment": "macOS Safari desktop qualification",
      "id": "BX-BH01-DEFER-MACOS-SAFARI-0.1",
      "owner": "browser-host and quality owners",
      "reactivation": "BH-22 or earlier when a governed macOS host becomes available",
      "status": "deferred"
    },
    {
      "environment": "Windows desktop browser qualification",
      "id": "BX-BH01-DEFER-WINDOWS-DESKTOP-0.1",
      "owner": "browser-host and quality owners",
      "reactivation": "BH-22 or earlier when a governed Windows host becomes available",
      "status": "deferred"
    },
    {
      "environment": "second clean controlled Linux execution context",
      "id": "BX-BH01-DEFER-SECOND-LINUX-HOST-0.1",
      "owner": "quality owner",
      "reactivation": "BH-22 or earlier when a second controlled Linux context becomes available",
      "status": "deferred"
    },
    {
      "environment": "required browser, assistive-technology, touch, and physical-keyboard pairings",
      "id": "BX-BH01-DEFER-MANUAL-AT-0.1",
      "owner": "accessibility and quality owners",
      "reactivation": "BH-22 or earlier when governed pairings and reviewers become available",
      "status": "deferred"
    }
  ],
  "disposable_lessons": [
    "BH-01 Elixir fixture modules and message tuples are examples, not public component APIs.",
    "BH-01 DOM operation names and JSON wire shapes are renderer experiments, not the neutral tree protocol.",
    "BH-01 Phoenix routes, session fixtures, command names, and audit shapes are not server-adapter contracts.",
    "BH-01 lifecycle state names and JavaScript callback shapes are not portable host contracts.",
    "BH-01 benchmark workloads and timing boundaries remain experimental methods.",
    "Popcorn, AtomVM, Phoenix, LiveView, browser, and toolkit implementation objects stay behind adapters."
  ],
  "forbidden_leakage": [
    "HTML or DOM node types in portable packages",
    "browser event or JavaScript callback objects in semantic APIs",
    "Phoenix, Plug, LiveView, or LocalLiveView dependencies in portable packages",
    "Popcorn or AtomVM types in semantic packages",
    "BH-01 fixture message tuples, route paths, command strings, or JSON shapes as public contracts",
    "private LiveView renderer data outside its optional adapter",
    "native toolkit handles or widget classes in portable component code"
  ],
  "goal": "Define the first host-neutral semantic kernel and prove that one interaction set can target headless, DOM, and a limited native-control spike without browser or toolkit objects in portable component code.",
  "limitations": [
    "Both authoritative clean executions used one physical Linux x86-64 host.",
    "Chrome and the Firefox development binary are observed development environments and remain unsupported.",
    "The unpruned application AVM fails decoded and compressed application payload budgets.",
    "Firefox development timer-event p95 exceeds the active local-event target.",
    "Representative Chrome timing reruns retain scheduler-sensitive drift.",
    "Private LiveView and LocalLiveView compatibility is exact-pins-only with standalone DOM fallback.",
    "Popcorn requires unsafe-eval and production security controls are not implemented.",
    "Physical mobile, Safari, Windows, second-machine, and manual assistive-technology qualification is deferred to BH-22.",
    "Mobile viability, accessibility conformance, production deployment, native compatibility, and release readiness are not established.",
    "BH-01 fixtures and protocols are disposable evidence rather than stable BlazeX APIs."
  ],
  "manifest_id": "BX-BH02-ENTRY-MANIFEST-0.1",
  "neutral_contract_constraints": [
    "Represent semantic nodes independently of any concrete renderer.",
    "Make identity explicit and deterministic across update, move, replacement, and disposal.",